{
  "runner": "css_harness",
  "runner_kind": "css-parse-robustness",
  "corpus": "wpt css/CSS2/syntax, css/css-syntax, css/selectors/parsing",
  "corpus_revision": "1924c6e9784b3c1da4ad5bfcbfeea64b2a886e7b",
  "oracle": "parse_stylesheet_bytes returns without error or panic; the parsed stylesheet is discarded",
  "total": 871,
  "executed": 603,
  "accepted": 603,
  "skip": 268,
  "rate_executed": 1.0,
  "measurement_environment": {
    "schema_version": 1,
    "timestamp_utc": "2026-08-07T03:55:33Z",
    "git": {
      "commit": "6f3beef19ea54e7a89f53fec553435f25fd0efc9",
      "branch": "measurement-provenance-envelope",
      "dirty": false
    },
    "toolchain": {
      "rustc": "1.94.1",
      "rustc_verbose": "rustc 1.94.1 (e408947bf 2026-03-25)"
    },
    "host": {
      "platform": "Linux-7.1.6-1-cachyos-x86_64-with-glibc2.44",
      "machine": "x86_64",
      "cpu_model": "AMD Ryzen 5 5600X3D 6-Core Processor",
      "logical_cpus": 12,
      "process_affinity": [
        0,
        1,
        2,
        3,
        4,
        5,
        6,
        7,
        8,
        9,
        10,
        11
      ],
      "load_average": [
        7.150390625,
        6.712890625,
        8.11865234375
      ],
      "cpu_governors": [
        "performance"
      ],
      "perf_event_paranoid": "2",
      "cache_topology": [
        {
          "index": "index0",
          "level": 1,
          "type": "Data",
          "size_bytes": 32768,
          "shared_cpu_list": "0,6",
          "ways_of_associativity": 8,
          "coherency_line_size": 64
        },
        {
          "index": "index1",
          "level": 1,
          "type": "Instruction",
          "size_bytes": 32768,
          "shared_cpu_list": "0,6",
          "ways_of_associativity": 8,
          "coherency_line_size": 64
        },
        {
          "index": "index2",
          "level": 2,
          "type": "Unified",
          "size_bytes": 524288,
          "shared_cpu_list": "0,6",
          "ways_of_associativity": 8,
          "coherency_line_size": 64
        },
        {
          "index": "index3",
          "level": 3,
          "type": "Unified",
          "size_bytes": 100663296,
          "shared_cpu_list": "0-11",
          "ways_of_associativity": 16,
          "coherency_line_size": 64
        }
      ],
      "last_level_cache_bytes": 100663296
    },
    "environment": {
      "WAYLAND_DISPLAY": "wayland-0",
      "DISPLAY": ":0",
      "XDG_SESSION_TYPE": "wayland"
    }
  }
}
