{
  "corpus": "wpt html/syntax/parsing/resources",
  "corpus_revision": "1924c6e9784b3c1da4ad5bfcbfeea64b2a886e7b",
  "executed": 1726,
  "expected_fail": 148,
  "fail": 0,
  "oracle": "The production parse tree serialized in html5lib format equals the corpus #document. Expected failures remain failures; unexpected passes count as genuine passes and fail the strict expectation gate.",
  "pass": 1578,
  "rate_executed": 0.9142526071842411,
  "rate_total": 0.8227320125130344,
  "runner": "html5lib_tree_construction",
  "runner_kind": "wpt-tree-construction",
  "skip": 192,
  "total": 1918,
  "unexpected_pass": 0,
  "measurement_environment": {
    "schema_version": 1,
    "timestamp_utc": "2026-09-22T07:36:23Z",
    "git": {
      "commit": "97e10f4f78f79078c5f9d96286b6a7f1bc99db80",
      "branch": "fix/browser-runtime-conformance",
      "dirty": true
    },
    "toolchain": {
      "rustc": "1.94.1",
      "rustc_verbose": "rustc 1.94.1 (e408947bf 2026-03-25)"
    },
    "host": {
      "platform": "Linux-7.2.5-1-cachyos-x86_64-with-glibc2.44",
      "machine": "x86_64",
      "cpu_model": "AMD Ryzen 5 5600X3D 6-Core Processor",
      "logical_cpus": 12,
      "process_affinity": [
        0,
        1,
        2,
        3,
        4,
        5,
        6,
        7,
        8,
        9,
        10,
        11
      ],
      "load_average": [
        12.92724609375,
        21.501953125,
        19.19189453125
      ],
      "cpu_governors": [
        "performance"
      ],
      "perf_event_paranoid": "2",
      "cache_topology": [
        {
          "index": "index0",
          "level": 1,
          "type": "Data",
          "size_bytes": 32768,
          "shared_cpu_list": "0,6",
          "ways_of_associativity": 8,
          "coherency_line_size": 64
        },
        {
          "index": "index1",
          "level": 1,
          "type": "Instruction",
          "size_bytes": 32768,
          "shared_cpu_list": "0,6",
          "ways_of_associativity": 8,
          "coherency_line_size": 64
        },
        {
          "index": "index2",
          "level": 2,
          "type": "Unified",
          "size_bytes": 524288,
          "shared_cpu_list": "0,6",
          "ways_of_associativity": 8,
          "coherency_line_size": 64
        },
        {
          "index": "index3",
          "level": 3,
          "type": "Unified",
          "size_bytes": 100663296,
          "shared_cpu_list": "0-11",
          "ways_of_associativity": 16,
          "coherency_line_size": 64
        }
      ],
      "last_level_cache_bytes": 100663296
    },
    "environment": {
      "RUSTFLAGS": " -D warnings",
      "WAYLAND_DISPLAY": "wayland-0",
      "DISPLAY": ":0",
      "XDG_SESSION_TYPE": "wayland"
    }
  }
}
